ID;TITLE;SENTIMENT;CATEGORY_DATA;len;CATEGORY_DATA_filtred
33580;Lawsuit Claims US Labor Department’s Crypto Guidance Is Unlawful;NEGATIVE;['BUSINESS', 'REGULATION'];2;BUSINESS:REGULATION
13619730;Commonwealth Bank Halts Payments to Crypto Exchanges;NEGATIVE;['FIAT', 'BLOCKCHAIN'];2;BLOCKCHAIN:FIAT
6575559;Bitcoin underperforms stocks, gold for the first time since 2018;NEGATIVE;['BTC', 'FIAT', 'BUSINESS', 'LUNA'];4;BTC:BUSINESS:FIAT
11855157;OKX and Manchester City Captain İlkay Gündoğan Launch Football Masterclass in the Metaverse;POSITIVE;['EXCHANGE', 'SPONSORED', 'TECHNOLOGY', 'TRADING'];4;TRADING:EXCHANGE:SPONSORED
4582119;Dogecoin (DOGE) takes support from the 200 EMA curve!;NEUTRAL;['DOGE', 'TRADING', 'CRV', 'MARKET'];4;TRADING:MARKET:DOGE
8699907;Charlie Munger Urges US Government to Ban Crypto Like China Has Done;NEGATIVE;['ASIA', 'SPONSORED'];2;SPONSORED:ASIA
15514588;Upbit Suspends CRV Transactions Following Curve Finance Exploit;NEGATIVE;['CRV', 'EXCHANGE', 'BLOCKCHAIN', 'ICO', 'MINING'];5;EXCHANGE:BLOCKCHAIN:ICO
9045495;‘ADA Whale’ Explains Why Cardano ($ADA) Is ‘The Most Obvious Play of All’;POSITIVE;['ADA', 'ALTCOIN'];2;ALTCOIN:ADA
14958227;Weekly NFT Sales Fall 4.33%, Bitcoin Burials NFT Fetches $1.68 Million;NEGATIVE;['BTC', 'ETH', 'BLOCKCHAIN', 'ICO', 'MATIC'];5;BTC:BLOCKCHAIN:ICO
5731297;Bitcoin slips, struggles to hold $17,000, Binance’s BNB slumps even further;NEGATIVE;['MARKET', 'BTC', 'EXCHANGE'];3;MARKET:BTC:EXCHANGE
10597252;Russian Crypto Tax Defaulters May Likely Face Jail Time;NEGATIVE;['REGULATION', 'BLOCKCHAIN', 'BUSINESS'];3;BUSINESS:BLOCKCHAIN:REGULATION
4260437;Snowfall Protocol (SNW) Is Set To Outperform Pancake Swap (CAKE) And Binance Coin (BNB);POSITIVE;['BLOCKCHAIN', 'EXCHANGE', 'BUSINESS', 'ICO', 'MARKET'];5;MARKET:BUSINESS:EXCHANGE
15530734;Terraform Labs May Be Holding Over $159,000,000 in Crypto Despite Claims of Almost Losing Everything: Arkham Intelligence;NEUTRAL;['BTC', 'ETH', 'BLOCKCHAIN', 'ICO'];4;BTC:BLOCKCHAIN:ICO
14997409;Elon Musk Effect: Twitter Loses Half of Advertising Revenue Since October;NEGATIVE;['BUSINESS', 'TECHNOLOGY'];2;BUSINESS:TECHNOLOGY
15073606;Robert F. Kennedy Jr. Wants Bitcoin Backed U.S. Dollars and Tax Breaks for Investors;POSITIVE;['BTC', 'BUSINESS', 'REGULATION'];3;BTC:BUSINESS:REGULATION
15831701;LAST MINUTE: Bitcoin Exchange Coinbase Officially Launches “BASE” Network!;POSITIVE;['BTC', 'EXCHANGE', 'BLOCKCHAIN'];3;BTC:EXCHANGE:BLOCKCHAIN
28727;Tether: With UST gone and USDD struggling, is USDT next in line;NEGATIVE;['USDT', 'LUNA', 'MARKET', 'SPONSORED'];4;MARKET:SPONSORED
2383703;Dogecoin price analysis: Bearish trendline intact, DOGE drops below $0.0600;NEGATIVE;['DOGE', 'TRADING', 'MARKET'];3;TRADING:MARKET:DOGE
35526;KuCoin Launches Decentralized Wallet to Serve Web3.0 Users;POSITIVE;['BLOCKCHAIN', 'BUSINESS', 'TRADING'];3;TRADING:BUSINESS:BLOCKCHAIN
12854599;MicroStrategy's Michael Saylor: Early Bitcoin BRC-20 Uses May Be ‘Illegal’;NEUTRAL;['BTC'];1;BTC
4632816;This Cardano NFTs Up 80% In Volume After Snoop Dogg’s New Video;POSITIVE;['ADA'];1;ADA
13498910;Bistroo Network Solves Restaurant-Food Delivery Problems;POSITIVE;['ICO'];1;ICO
4099987;'Like a 1930s Dictator': Vitalik Buterin Lays Into Sam Bankman-Fried and FTX;NEGATIVE;['ETH', 'BUSINESS'];2;BUSINESS:ETH
8772677;Assessing reasons behind Cardano’s bull rally in January 2023;POSITIVE;['ADA', 'TRADING', 'ALTCOIN', 'ETH', 'ICO'];5;TRADING:ICO:ETH
7727122;2022 In Review: The Media’s Stigma Around Cryptocurrency Persists;NEGATIVE;['ASIA', 'BLOCKCHAIN', 'SPONSORED', 'TECHNOLOGY'];4;BLOCKCHAIN:SPONSORED:TECHNOLOGY
24929;Cardano’s NFT Market Gaining Rapidly On Solana, Ether As ADA Ecosystem Sees Explosive Growth;POSITIVE;['ADA', 'SOL', 'MARKET'];3;MARKET:ADA
15674370;Bitcoin prices must break $100,000 for crypto miners to stay profitable;NEUTRAL;['BTC', 'MARKET', 'MINING'];3;MARKET:BTC:MINING
25467;Goldman Sachs Reportedly Keen To Raise $2 Billion To Purchase Celsius Assets;NEGATIVE;['ICO', 'SPONSORED'];2;ICO:SPONSORED
6154;FTX Is Not Acquiring Robinhood: HOOD Plunges For 3.5%;NEGATIVE;['BUSINESS', 'TRADING'];2;TRADING:BUSINESS
27408;ADA Sees Boost In Market Share Even As Hotly Anticipated Cardano Vasil Hard Fork Is Deferred;NEUTRAL;['ADA', 'MARKET'];2;MARKET:ADA
12886554;NFT Toys Make it Big on Amazon as Tron, Polkadot and Big Eyes Coin Lead Best Crypto Projects in 2023;POSITIVE;['DOT', 'MARKET', 'SPONSORED'];3;MARKET:SPONSORED
12301601;Coinbase Launches International Exchange for Bitcoin and Ether Perpetual Futures;POSITIVE;['BTC', 'EXCHANGE', 'ETH', 'ICO', 'REGULATION'];5;BTC:EXCHANGE:REGULATION
13059252;Binance initiates layoffs amid market uncertainty, sources claim;NEGATIVE;['EXCHANGE', 'BLOCKCHAIN', 'MARKET'];3;MARKET:EXCHANGE:BLOCKCHAIN
13495582;Coinbase to institutional data analytics platform for cryptocurrency markets;POSITIVE;['MARKET', 'REGULATION'];2;MARKET:REGULATION
15863571;Ethereum Co-founder Vitalik Buterin Shares Insights on Sam Bankman-Fried’s Reputation;NEUTRAL;['ETH', 'EXCHANGE'];2;EXCHANGE:ETH
13039659;Tether Expands: Stablecoin Issuer Announces Sustainable Bitcoin Mining Project in Uruguay;POSITIVE;['USDT', 'MINING', 'BTC'];3;BTC:MINING
35887;SEC vs. Ripple: Hinman Docs Become Focus of New Conference;NEUTRAL;['XRP', 'REGULATION'];2;REGULATION:XRP
12108971;Venom Foundation Announces the Release of its Public Testnet;NEUTRAL;['ETH', 'BLOCKCHAIN', 'ICO', 'MARKET', 'SPONSORED'];5;MARKET:BLOCKCHAIN:ICO
4004064;Whales Move 877,000,000,000 Shiba Inu (SHIB) in Series of Massive Crypto Transactions Amid Extreme Market Volatility;NEUTRAL;['SHIB', 'MARKET', 'ETH', 'ICO', 'ALTCOIN'];5;MARKET:ICO:ETH
12365165;"Ethereum (ETH) and Fantom (FTM) Look Good; Investors Move to Collateral Network (COLT) for 35x Gains";POSITIVE;['ETH', 'FTM', 'BUSINESS', 'MARKET', 'MINING'];5;MARKET:BUSINESS:ETH
12748245;Binance Hosts Global Celebrations in Honor of Bitcoin Pizza Day;POSITIVE;['BTC', 'EXCHANGE', 'BLOCKCHAIN', 'SPONSORED'];4;BTC:EXCHANGE:BLOCKCHAIN
14080796;Bitcoin Will be the Best Trade of the Decade, Gemini Co-Founder Says;POSITIVE;['BTC'];1;BTC
15271452;AVAX traders need to be on their toes amid Avalanche’s latest drop in…;NEGATIVE;['AVAX', 'TRADING', 'ALTCOIN'];3;TRADING:ALTCOIN
2791061;Binance accounting bug leads to $20m misallocation of HNT tokens;NEGATIVE;['EXCHANGE', 'ICO', 'ETH'];3;EXCHANGE:ICO:ETH
3856071;BNB Price Crashed Heavily as the Binance Chain Halts Following a Major Hack of 2M BNB Tokens Worth $550M;NEGATIVE;['ICO', 'TRADING', 'EXCHANGE', 'ALTCOIN'];4;TRADING:EXCHANGE:ICO
43260;How to become better in Ethereum gambling;NEUTRAL;['ETH', 'SPONSORED'];2;ETH:SPONSORED
13786714;Privacy should be considered in ‘potential retail CBDC’ — Treasury official;NEUTRAL;['REGULATION', 'FIAT'];2;REGULATION:FIAT
3434921;Investors Are Massively Shorting Ethereum and There Are 3 Reasons Why;NEGATIVE;['ETH', 'BUSINESS', 'TRADING'];3;TRADING:BUSINESS:ETH
15489823;Shiba Inu Joins Elite Ranks After SHIB Market Cap Soars by Half a Billion Dollars;POSITIVE;['SHIB', 'MARKET'];2;MARKET:SHIB
10243274;EOS hit a key roadblock – Can shorting yield profit?;NEUTRAL;['MARKET', 'ALTCOIN', 'BUSINESS', 'TRADING'];4;TRADING:MARKET:BUSINESS
30849;Applied Blockchain shares dive 52% amid market sell-off, crypto declines;NEGATIVE;['BLOCKCHAIN', 'BUSINESS', 'ETH', 'MARKET', 'MINING'];5;MARKET:BUSINESS:BLOCKCHAIN
13033496;DigiToads (TOADS) Gains Momentum Amidst Memecoin Boom, Leaving Floki Inu (FLOKI) in its Wake;NEUTRAL;['MARKET', 'ICO', 'SPONSORED', 'TRADING'];4;TRADING:MARKET:ICO
12133460;"Tron (TRX) Price Drops 2% After Stake 2.0 Disappoints; Investors Switch to Collateral Network (COLT) Following 40% Surge";NEGATIVE;['BUSINESS', 'TRADING', 'TRX', 'SPONSORED'];4;TRADING:BUSINESS:SPONSORED
12773518;Bitcoin Whales Accumulate $2.32 Billion Worth of $BTC in a Month;POSITIVE;['BTC', 'BLOCKCHAIN'];2;BTC:BLOCKCHAIN
3852266;Cardano’s success isn’t delayed, credit goes to these factors;POSITIVE;['ADA', 'ALTCOIN', 'BLOCKCHAIN', 'TRADING', 'WALLET'];5;TRADING:BLOCKCHAIN:ALTCOIN
9399753;Elliptic Reports that Blender Rebrands as Sinbad;NEGATIVE;['TECHNOLOGY'];1;TECHNOLOGY
56273;Bitcoin Hovering Around $40,000! Here’s What Traders Can Expect in the Upcoming Day’s Trade!;NEGATIVE;['BTC', 'TRADING', 'BLOCKCHAIN'];3;TRADING:BTC:BLOCKCHAIN
13082773;Touchdown Fumble: NFLPA’s NFT Revenue Takes a Hit;NEGATIVE;['BUSINESS', 'ICO'];2;BUSINESS:ICO
12772479;Binance scouts Web3 entrepreneurs, yet TMS Network stays ahead of Solana & Uniswap;NEUTRAL;['SOL', 'EXCHANGE', 'BLOCKCHAIN', 'ICO', 'TECHNOLOGY'];5;EXCHANGE:BLOCKCHAIN:ICO
12529013;Kraken Testifies to Congress for Crypto Regulation;POSITIVE;['REGULATION', 'TECHNOLOGY'];2;REGULATION:TECHNOLOGY
3848937;Analyst Maps Next Levels For FTM, INJ & NEAR Price, Warns Bitcoin Downtrend !;NEUTRAL;['BTC', 'ALTCOIN', 'FTM', 'ADA', 'ETH'];5;BTC:ETH:ALTCOIN
15475087;How Breakthrough L3 F-TOUCH Wireless Sensor Enhances Robots’ Sense of Touch and Manipulation;POSITIVE;['ASIA'];1;ASIA
5326;Risk of ‘Significant Drawdowns’ Pushes Cypherpunk Holdings to Sell Entire Stash of Bitcoin and Ethereum;NEGATIVE;['BTC', 'ETH', 'REGULATION'];3;BTC:REGULATION:ETH
4068;Crypto tax: Romania’s financial watchdog introduces new regulations;NEUTRAL;['REGULATION', 'TRADING'];2;TRADING:REGULATION
3498245;THORChain Network back online after 20 hours of outage due to a software bug;NEUTRAL;['TECHNOLOGY', 'BLOCKCHAIN', 'BUSINESS'];3;BUSINESS:BLOCKCHAIN:TECHNOLOGY
8833937;FBI Seizes $100K in NFTs From Scammer;NEUTRAL;['BLOCKCHAIN', 'BUSINESS', 'ICO'];3;BUSINESS:BLOCKCHAIN:ICO
3850157;Mango Markets to Soon Return Stolen Funds!;POSITIVE;['MARKET', 'EXCHANGE'];2;MARKET:EXCHANGE
43779;Onecoin ‘Crypto Queen’ Ruja Ignatova Listed Among Europe’s Most Wanted;NEGATIVE;['BUSINESS', 'BTC', 'MINING'];3;BTC:BUSINESS:MINING
15742240;Justin Sun Rejects Huobi’s Insolvency Rumors, Says the Exchange Will ‘Thrive’;POSITIVE;['ASIA', 'EXCHANGE'];2;EXCHANGE:ASIA
3424530;Ethereum’s Merge Triggers Confusion Over Tax Status In The UK: Here’s How;NEUTRAL;['ETH', 'REGULATION'];2;REGULATION:ETH
3854098;Grayscale says SEC harmed investors in new brief appealing ETF rejection;NEUTRAL;['REGULATION', 'BUSINESS'];2;BUSINESS:REGULATION
3857154;Ethereum Aims At Big Market Return If Breaks This Level Successfully: Crypto Market Review, October 4;NEUTRAL;['MARKET', 'XRP', 'BUSINESS', 'ETH'];4;MARKET:BUSINESS:ETH
11835011;Hacker Exploits Hundred Finance Protocol In $7.4 Million Heist;NEGATIVE;['BLOCKCHAIN', 'BUSINESS', 'ICO'];3;BUSINESS:BLOCKCHAIN:ICO
3398000;Ethereum co-founder raises concerns over ETH’s centralization post-Merge;NEGATIVE;['ETH', 'BLOCKCHAIN', 'MARKET'];3;MARKET:BLOCKCHAIN:ETH
14212053;$2.3 Trillion Asset Management Behemoth Granted Crypto Custody License in France;POSITIVE;['FIAT', 'MARKET'];2;MARKET:FIAT
892066;Interview: Caduceus’ Co-Founder Tim Bullman on How They are Shaping the Future of Metaverse;POSITIVE;['BLOCKCHAIN', 'TECHNOLOGY', 'ICO', 'BUSINESS', 'MARKET', 'ETH'];6;MARKET:BUSINESS:BLOCKCHAIN
13619228;Sensedia’s APIX 2023 Offers Expert Insights on API Trends, Strategies and Technology;POSITIVE;['BUSINESS', 'TECHNOLOGY'];2;BUSINESS:TECHNOLOGY
15487692;These 5 crypto declined most in July: Pepe and other underperformers;NEGATIVE;['MARKET', 'BCH', 'FTM', 'ICO'];4;MARKET:ICO
11085701;Greenpeace art installation ‘Skull of Satoshi’ sparks debate on Bitcoin’s impact on environment;NEUTRAL;['BTC'];1;BTC
12954993;Peter Schiff To Launch His Bitcoin NFT Artwork, Arthur Madrid’s Twitter Account Hacked;NEUTRAL;['BTC', 'ICO', 'MARKET', 'SAND'];4;MARKET:BTC:ICO
4917226;Market Analysis Report (29 Nov 2022);NEUTRAL;['MARKET', 'BTC', 'ETH'];3;MARKET:BTC:ETH
14336317;CME Group Announces Ether/Bitcoin Ratio Futures;POSITIVE;['BTC', 'ETH', 'MARKET', 'ICO'];4;MARKET:BTC:ICO
1941863;Ethereum Classic (ETC) Sees Massive Increase in Hashrate Ahead of Merge Event;POSITIVE;['ETC', 'MINING'];2;MINING
13585400;Celer Network (CELR) Price Surges 36% in Last 24 Hours;POSITIVE;['ALTCOIN', 'BLOCKCHAIN', 'ICO', 'TRADING'];4;TRADING:BLOCKCHAIN:ICO
7713961;Analyst Believes that ADA Will Fall to $0.15 in Coming Weeks;NEGATIVE;['ADA', 'TRADING', 'ALTCOIN'];3;TRADING:ALTCOIN:ADA
10957198;Stellar Lumens price is roaring back: how high can XLM jump?;POSITIVE;['XLM', 'TRADING', 'FIAT'];3;TRADING:FIAT
12527729;Polygon Bridge TVL Increases by 52% In a Single Day: Report;POSITIVE;['MATIC', 'MARKET'];2;MARKET
874344;Analyst Predicts Pullbacks for Ethereum Classic and One Low-Cap Altcoin, Updates Outlook on Solana and ApeCoin;NEGATIVE;['SOL', 'ALTCOIN', 'ETC', 'TRADING', 'BLOCKCHAIN'];5;TRADING:BLOCKCHAIN:ALTCOIN
3439850;Shiba Inu sees an uptrend after weeks, but for how long can it last;NEUTRAL;['SHIB', 'TRADING', 'ALTCOIN', 'MARKET'];4;TRADING:MARKET:ALTCOIN
11227535;XRP Paints Reversal Candlestick Pattern After 30% Rally;NEGATIVE;['XRP', 'TRADING'];2;TRADING:XRP
12257884;The Strength of Bitcoin: HODLing, High Transaction Counts, Address Activity, Bitcoin NFTs;POSITIVE;['BTC', 'BLOCKCHAIN'];2;BTC:BLOCKCHAIN
2325660;Waves price analysis: WAVES/USD shows dormant behavior at $4.42 after bearish run;NEGATIVE;['TRADING', 'MARKET'];2;TRADING:MARKET
3856375;Ethereum Name Service (ENS) Breaks Out, Can Price Hit $20?;POSITIVE;['TRADING', 'ETH', 'MARKET', 'DOT', 'USDT'];5;TRADING:MARKET:ETH
13762233;Binance.US counters SEC’s motion to freeze funds as it threatens its business;NEGATIVE;['REGULATION', 'EXCHANGE', 'BUSINESS'];3;BUSINESS:EXCHANGE:REGULATION
29759;How Crypto Learned to Love the Bear;NEUTRAL;['TRADING'];1;TRADING
9587902;Ethereum Hits Peak of $1,700 As Investors Add 1.88 Million ETH Since November: Report;POSITIVE;['ETH', 'BUSINESS'];2;BUSINESS:ETH
7259041;"MakerDAO set to implement parameter changes; a look at lending markets";NEUTRAL;['BLOCKCHAIN', 'MARKET', 'ALTCOIN', 'MKR'];4;MARKET:BLOCKCHAIN:ALTCOIN
5218122;XRP Price May Remain Bearish Despite the Judgement Turns in Favour of Ripple;NEGATIVE;['TRADING', 'XRP', 'REGULATION'];3;TRADING:REGULATION:XRP
4799770;Edward Snowden Criticizes MetaMask’s Latest Policy Revision;NEGATIVE;['BLOCKCHAIN', 'BUSINESS', 'ETH', 'TECHNOLOGY'];4;BUSINESS:BLOCKCHAIN:ETH
11484717;The Trouble with Crypto Bank Silvergate Is Growing;NEGATIVE;['FIAT', 'BTC'];2;BTC:FIAT
15151173;Sam Bankman-Fried’s brother planned to buy island and prep for apocalypse: court filing;NEGATIVE;['ETH', 'REGULATION'];2;REGULATION:ETH
12977711;Arbitrum Liquidity Protocol Jimbos Hacked, 4k ETH Worth $7.5M Stolen;NEGATIVE;['BLOCKCHAIN', 'ETH', 'ICO', 'MARKET'];4;MARKET:BLOCKCHAIN:ICO
10604556;USDC, crypto rallies on news that SVB, Signature Bank deposits are safe;POSITIVE;['FIAT', 'MARKET'];2;MARKET:FIAT
12165741;A Decisive Factor For Gen Z Voters According To Bitget Research;POSITIVE;['TRADING'];1;TRADING
10376042;South Korea saw over $4B unregistered crypto transactions in 2022;NEGATIVE;['ASIA', 'MARKET'];2;MARKET:ASIA
14871275;South Korean Exchange Leads in XRP Trading, with $2.5B in 24-Hour Volume;POSITIVE;['XRP', 'TRADING', 'EXCHANGE', 'ASIA', 'MARKET'];5;TRADING:MARKET:EXCHANGE
7303326;Decoding current state of Bitcoin amid the decline in number of large transactions;NEGATIVE;['BTC', 'ICO'];2;BTC:ICO
14075447;Crypto News: Experts Predict Banks Vanishing as Cryptocurrencies Gain Ground;POSITIVE;['FIAT', 'BUSINESS'];2;BUSINESS:FIAT
14907144;Coinbase Stock Expected to Surge Following XRP Relisting, Analyst Predicts Targets;POSITIVE;['XRP', 'BUSINESS', 'REGULATION', 'EXCHANGE'];4;BUSINESS:EXCHANGE:REGULATION
1644181;Post Voyager Announces the Launch of Jellyme, MOOI Network’s NFT Marketplace;POSITIVE;['ASIA', 'BLOCKCHAIN', 'ICO', 'SPONSORED'];4;BLOCKCHAIN:ICO:SPONSORED
14352162;Cardinal Labs Shuts Shop;NEGATIVE;['BLOCKCHAIN', 'SOL', 'MARKET', 'ICO', 'REGULATION'];5;MARKET:BLOCKCHAIN:REGULATION
782587;Blockify: Using Blockchain to Reimagine Social Media;NEUTRAL;['BLOCKCHAIN', 'TECHNOLOGY', 'SPONSORED'];3;BLOCKCHAIN:SPONSORED:TECHNOLOGY
13013879;US Bitcoin Corp to Operate Restructured Mining Division of Celsius, Boosting Hashrate by 12.2 EH/s;POSITIVE;['MINING', 'BTC'];2;BTC:MINING
13576111;Forum Blockchain Life 2021 April 21-22, Moscow, Music Media Dome;NEUTRAL;['BLOCKCHAIN', 'BUSINESS', 'MINING', 'SPONSORED'];4;BUSINESS:BLOCKCHAIN:SPONSORED
1796245;Synthetix (SNX) Price Doesn't Follow Revenue Boom, Here's Why;NEUTRAL;['SNX', 'TRADING', 'BUSINESS', 'ICO'];4;TRADING:BUSINESS:ICO
5263404;Terra Classic Developers Cease Support For Terra Station To Divert Focus To Rebel Station;NEGATIVE;['LUNC', 'ALTCOIN', 'MARKET'];3;MARKET:ALTCOIN
12093515;Aptos Drops to Single Digits Prior to APT Token Unlock Event;NEGATIVE;['ALTCOIN', 'ICO'];2;ICO:ALTCOIN
2464278;Blockchain.com wins provisional regulatory approval to operate in Dubai - report;POSITIVE;['EXCHANGE', 'BLOCKCHAIN'];2;EXCHANGE:BLOCKCHAIN
31637;Bitcoin Needs To Be More Private For Adoption;NEUTRAL;['BTC', 'TRADING'];2;TRADING:BTC
10111011;Massive Shiba Inu Whale Moves Nearly 92 Billion $SHIB to Indonesian Crypto Exchange as Price Drops;NEGATIVE;['SHIB', 'TRADING', 'ALTCOIN', 'BLOCKCHAIN', 'ETH'];5;TRADING:BLOCKCHAIN:ETH
58050;Will Smith Inu: A cryptocurrency born from Will Smith’s slap at the Oscars’ 94th edition;POSITIVE;['ALTCOIN', 'BUSINESS'];2;BUSINESS:ALTCOIN
13067195;Payments Giant PayPal Invests in New Crypto Wallet Software in Push for Web3 Adoption;POSITIVE;['TECHNOLOGY', 'ICO'];2;ICO:TECHNOLOGY
46084;Cardano Set to Onboard Game-Changing Algorithmic Stablecoins, Rivaling Terra’s UST;POSITIVE;['ADA', 'LUNA'];2;ADA
14144736;Celsius Creditors Allege Wintermute’s Potential Involvement in Manipulative Trading Scheme;NEGATIVE;['TRADING', 'MARKET', 'BUSINESS', 'ICO', 'MKR'];5;TRADING:MARKET:BUSINESS
4311719;Turkey’s Financial Intelligence Unit Launches Investigation Into FTX Collapse;NEGATIVE;['EXCHANGE', 'TRADING'];2;TRADING:EXCHANGE
1340856;Crypto venture capital firm Dragonfly acquires hedge fund MetaStable;NEUTRAL;['AVAX', 'BUSINESS', 'ETH', 'MARKET'];4;MARKET:BUSINESS:ETH
10994417;Analysts Recommend Selling IOTA (MIOTA) and Dogecoin (DOGE) For Collateral Network (COLT) Presale;NEGATIVE;['DOGE', 'ICO', 'MARKET', 'SPONSORED', 'TRADING'];5;TRADING:MARKET:ICO
896007;DeHub Makes History By Announcing New $1 Million NFT Raffle;POSITIVE;['MARKET', 'SPONSORED'];2;MARKET:SPONSORED
14993448;Scam Alert: SHIB Team Did Not Create UNLEASH Token – SHIB Army Beware;NEGATIVE;['SHIB', 'ICO'];2;ICO:SHIB
13495089;Dogecoin founder Jackson Palmer severs ties with cryptocurrency world;NEGATIVE;['DOGE', 'ADA', 'BTC', 'ETH', 'LTC'];5;BTC:ETH:ADA
1677020;Bitcoin price consolidates above $21,000 as big move imminent for BTC;NEUTRAL;['BTC', 'TRADING', 'FIAT'];3;TRADING:BTC:FIAT
3848899;Bitcoin․com Launches NFT Project – Buyers in VERSE Token Sale to Receive Exclusive NFTs;NEUTRAL;['ICO', 'SPONSORED'];2;ICO:SPONSORED
15478554;Curve Finance’s exploit leads to a $1m reward block!;NEGATIVE;['CRV', 'MINING'];2;MINING
11656008;French central bank looks at certification, incorporation as part of DeFi regulation;NEUTRAL;['REGULATION', 'FIAT'];2;REGULATION:FIAT
8494219;Blockchain Bundle Research Service: Global Market Shares, Market Strategies, and Market Forecasts, 2022 to 2028 – ResearchAndMarkets.com;NEUTRAL;['MARKET', 'BLOCKCHAIN'];2;MARKET:BLOCKCHAIN
14574638;Binance To Retire XRP Addresses in Upcoming Wallet Upgrade: What You Need to Do;NEUTRAL;['EXCHANGE', 'XRP', 'BLOCKCHAIN', 'MARKET'];4;MARKET:EXCHANGE:BLOCKCHAIN
5022091;Italy to Start Taxing Crypto Trading Gains From 2023 (Report);NEUTRAL;['TRADING', 'BUSINESS', 'REGULATION'];3;TRADING:BUSINESS:REGULATION
10189247;Circle, Paxos, Bitstamp and Galaxy join Coinbase in scaling back partnerships with Silvergate Bank;NEGATIVE;['BLOCKCHAIN', 'BUSINESS', 'FIAT'];3;BUSINESS:BLOCKCHAIN:FIAT
11408338;Polygon (MATIC) vs. RenQ Finance (RENQ), Which Of These Can Provide 30x Returns In 2023?;NEUTRAL;['MATIC', 'BLOCKCHAIN', 'ETH', 'MARKET', 'SPONSORED'];5;MARKET:BLOCKCHAIN:ETH
14288175;Cardano Foundation Exec Calls for End to ‘Ultimate Blockchain’ Debate;NEUTRAL;['ADA', 'BLOCKCHAIN', 'ETH', 'ICO', 'REGULATION'];5;BLOCKCHAIN:REGULATION:ICO
14514711;Advocates call for Hong Kong govt stablecoin to compete with Tether and USD Coin;POSITIVE;['FIAT', 'USDT', 'ASIA', 'BLOCKCHAIN', 'BUSINESS'];5;BUSINESS:BLOCKCHAIN:FIAT
2952647;Ethereum’s Vanity Addresses Exploited for $3 Million;NEGATIVE;['ETH', 'ALTCOIN', 'BLOCKCHAIN'];3;BLOCKCHAIN:ETH:ALTCOIN
3858414;Solana Outage Becoming a Recurring Event Worrying Investors;NEGATIVE;['SOL', 'ALTCOIN', 'BUSINESS'];3;BUSINESS:ALTCOIN
3702148;Going long on SUSHI? You should take a look at these metrics first;NEUTRAL;['SUSHI', 'ALTCOIN', 'ETH', 'ICO', 'TRADING'];5;TRADING:ICO:ETH
14912589;A Million-Dollar Oversight? Ripple CTO Regrets Missed Investment Opportunity;NEGATIVE;['XRP', 'BUSINESS', 'ICO', 'REGULATION', 'TECHNOLOGY'];5;BUSINESS:REGULATION:ICO
13557260;SYN CITY Appoints Grammy Award Nominee Swae Lee As CEO;POSITIVE;['ASIA', 'SPONSORED'];2;SPONSORED:ASIA
11984611;How to stake Polygon (MATIC);POSITIVE;['MATIC', 'EXCHANGE'];2;EXCHANGE
10330338;Bitcoin Flatlines at $22.4K Ahead of Powell’s Congress Testimony: Market Watch;NEUTRAL;['ALTCOIN', 'BTC', 'MARKET'];3;MARKET:BTC:ALTCOIN
9147556;BTC, ETH Plunge 4% Following SEC Termination of Kraken Staking;NEGATIVE;['REGULATION', 'BTC', 'ETH'];3;BTC:REGULATION:ETH
11988540;Best Cryptos To Buy Now in April 2023;POSITIVE;['BUSINESS', 'ICO', 'MARKET', 'SPONSORED'];4;MARKET:BUSINESS:ICO
12562550;Tezos, and Flow Crypto Losing Holders to This New Utility Token: Collateral Network;NEGATIVE;['ICO', 'XTZ', 'BUSINESS', 'SPONSORED'];4;BUSINESS:ICO:SPONSORED
10829865;Price analysis 3/17: BTC, ETH, BNB, XRP, ADA, DOGE, MATIC, SOL, DOT, SHIB;POSITIVE;['BTC', 'ADA', 'DOGE', 'DOT', 'ETH'];5;BTC:ETH:ADA
13623965;SEC Chair Gary Gensler Derided for Shock Binance Ties;NEGATIVE;['EXCHANGE', 'REGULATION'];2;EXCHANGE:REGULATION
12150410;Recap of BKEX Hong Kong Night | 2023 Hong Kong Web3 Carnival;POSITIVE;['ASIA'];1;ASIA
40078;Dogecoin price analysis: DOGE continues to face rejection below $0.1 mark;NEGATIVE;['DOGE', 'TRADING', 'MARKET'];3;TRADING:MARKET:DOGE
55862;BAYC, ApeCoin, Coinbase- Decoding the NFT mania;NEUTRAL;['ICO', 'BUSINESS', 'TRADING'];3;TRADING:BUSINESS:ICO
13860505;Shiba Inu Poised to End June with 64% Gain, Per Industry Estimates;POSITIVE;['SHIB', 'MARKET'];2;MARKET:SHIB
11073597;Polkadot (DOT) Price Prediction 2025-2030: Will DOT reach $10 in 2030?;NEUTRAL;['DOT', 'TRADING', 'ALTCOIN'];3;TRADING:ALTCOIN
11755664;Blockchain Association CEO Detained in Costa Rica Is Back Home;NEUTRAL;['BLOCKCHAIN', 'BUSINESS', 'ETH'];3;BUSINESS:BLOCKCHAIN:ETH
4309641;Luna Foundation Guard Spent $2.8B Defending UST Peg, Third-Party Audit Finds;NEUTRAL;['LUNA', 'ETH', 'BUSINESS'];3;BUSINESS:ETH
37696;Crypto Analyst Says Altcoin Bulls Are Taking a Dangerous Gamble As Bitcoin Dominance Surges – Here’s Why;NEGATIVE;['BTC', 'ALTCOIN', 'MARKET'];3;MARKET:BTC:ALTCOIN
3308975;AtlanticHoldingsinv.com Review: Is this an Efficient Forex Broker? Atlantic Holdings Inv Review;NEUTRAL;['TRADING', 'MARKET', 'SPONSORED'];3;TRADING:MARKET:SPONSORED
4614575;Federal Reserve Bank President Says ‘Entire Notion of Crypto Is Nonsense’;NEGATIVE;['REGULATION', 'FIAT', 'EXCHANGE'];3;EXCHANGE:REGULATION:FIAT
13154502;XRP Community on High Alert as 21M XRP Lost in Atomic Wallet Hack;NEGATIVE;['XRP', 'MARKET'];2;MARKET:XRP
30747;CEL Token Collapses 99% From Highs As Celsius Network Halts All Withdrawals;NEGATIVE;['ICO', 'MARKET', 'ALTCOIN'];3;MARKET:ICO:ALTCOIN
9446;Binance Sets Fire to $444M Worth of BNB in Quarterly Burning Event;POSITIVE;['EXCHANGE', 'ALTCOIN'];2;EXCHANGE:ALTCOIN
2726168;ETH Borrow Rate Spikes to 190% Ahead of the Anticipated Merge;NEGATIVE;['ETH', 'BLOCKCHAIN', 'BUSINESS', 'AAVE', 'MARKET'];5;MARKET:BUSINESS:BLOCKCHAIN
10125240;ENS: Will low user activity pose a problem in the long run?;NEGATIVE;['ALTCOIN', 'BLOCKCHAIN'];2;BLOCKCHAIN:ALTCOIN
12447909;TUSD readies operation plan for international transition;NEUTRAL;['ASIA', 'SPONSORED'];2;SPONSORED:ASIA
50133;New York State Assembly Passed Moratorium Bill Targeted at Carbon-Based PoW Mining Sites;NEUTRAL;['MINING', 'REGULATION'];2;REGULATION:MINING
13557949;President of Belarus: “Start Mining Cryptocurrencies or Whatever It’s Called”;POSITIVE;['MINING', 'REGULATION'];2;REGULATION:MINING
10273773;Tron burns hot as TRX readies itself for range breakout, details inside;POSITIVE;['TRX', 'ICO', 'ALTCOIN'];3;ICO:ALTCOIN
14856031;SEC has no “unbounded jurisdiction over crypto”, Ripple’s Chief Legal Officer says;POSITIVE;['XRP', 'REGULATION', 'ICO', 'ALTCOIN', 'BLOCKCHAIN'];5;BLOCKCHAIN:REGULATION:ICO
15286878;Binance Set to Make Japan Its Next Powerhouse;POSITIVE;['EXCHANGE', 'ASIA'];2;EXCHANGE:ASIA
6079230;Positive Sentiment Expected to Persist in Monero (XMR) as Prices Surge by 0.94%;POSITIVE;['XMR', 'MARKET', 'TRADING'];3;TRADING:MARKET
624120;Vitalik Buterin says The Merge is Not 'Priced in' as Investor Promises to Fork Ethereum;NEUTRAL;['ETH', 'BUSINESS', 'MARKET'];3;MARKET:BUSINESS:ETH
11414661;Cardano (ADA) Price Needs to Pass This Test to Trigger Bullish Rally;NEUTRAL;['ADA', 'TRADING'];2;TRADING:ADA
4640667;Blockchain Analysis Firm Issues Alert, Says Over $60,000,000 in Crypto Stolen From FTX on the Move;NEGATIVE;['MARKET', 'BLOCKCHAIN', 'ETH'];3;MARKET:BLOCKCHAIN:ETH
3630505;Publicly-Listed Bitcoin Miner Argo Blockchain’s Stock Gets Downgraded, Firm Offloads Close to 4,000 Bitmain Miners;NEGATIVE;['BLOCKCHAIN', 'BTC', 'BUSINESS', 'MARKET', 'MINING'];5;MARKET:BTC:BUSINESS
13574594;Donald Trump calls Bitcoin a scam again;NEGATIVE;['BTC', 'FIAT', 'REGULATION'];3;BTC:REGULATION:FIAT
14473723;Four US Banking Giants Now Have $205,000,000,000 in Unrealized Losses Sitting on Balance Sheets: Report;NEGATIVE;['FIAT', 'MARKET'];2;MARKET:FIAT
