ID;TITLE;SENTIMENT;CATEGORY_DATA;len;CATEGORY_DATA_filtred
13494707;ETF centered around crypto and the digital economy prepares for launch;NEUTRAL;['EXCHANGE', 'BTC', 'BUSINESS', 'MINING', 'TECHNOLOGY'];5;BTC:BUSINESS:EXCHANGE
13184734;Crypto Prices Rising Again After Regulatory FUD: Bitcoin, Ethereum & Meme Coins Bounce After Escaping SEC Wrath;POSITIVE;['BTC', 'ETH', 'REGULATION', 'DOGE', 'MARKET'];5;MARKET:BTC:REGULATION
930844;Crypto Markets Recover $40B as FLOW Explodes 60% Daily (Market Watch);POSITIVE;['MARKET', 'BLOCKCHAIN'];2;MARKET:BLOCKCHAIN
14204775;Ripple News : Did The SEC-Ripple Lawsuit Propel XRP Adoption, Deaton’s Observations Spur Intrigue;POSITIVE;['XRP', 'REGULATION'];2;REGULATION:XRP
374;For Monero bulls this zone remains a critical resistance level to overcome;NEUTRAL;['XMR', 'ALTCOIN', 'BTC', 'MARKET', 'TRADING'];5;TRADING:MARKET:BTC
12914301;Crypto.com lists euro pairs for bitcoin, ethereum traders;NEUTRAL;['FIAT', 'BTC', 'ETH', 'EXCHANGE', 'USDT'];5;BTC:EXCHANGE:ETH
15510317;LeetSwap Halts Trading After $630K Drained From Liquidity Pairs;NEGATIVE;['BLOCKCHAIN', 'TRADING'];2;TRADING:BLOCKCHAIN
12456281;Principality of Liechtenstein Embraces Bitcoin: Govt. Services to Accept Crypto;POSITIVE;['BTC', 'ICO'];2;BTC:ICO
2258;Bitcoin mining difficulty falls by 1.41%;NEUTRAL;['BTC', 'MINING'];2;BTC:MINING
15003075;Ripple’s major success in its court battle with the SEC: Law Decoded, July 10–17;POSITIVE;['REGULATION', 'XRP', 'EXCHANGE'];3;EXCHANGE:REGULATION:XRP
13004010;Hong Kong Police Launches Metaverse Platform to Combat Cybercrimes;NEUTRAL;['ASIA', 'TECHNOLOGY'];2;TECHNOLOGY:ASIA
12852280;PSYOP Token Investors Lose Half Their Funds After ‘Scam' – Here’s Three Coins You Can Trust;NEGATIVE;['BUSINESS', 'ICO'];2;BUSINESS:ICO
12363262;Brazilian President Lula to Act as BRICS Liaison to Help Argentina, Discusses Credit Line in Brazilian Reals;POSITIVE;['FIAT', 'REGULATION'];2;REGULATION:FIAT
14802240;South Korea to Mandate Firms Issue Crypto Disclosures in Financial Statements;NEUTRAL;['ASIA', 'BUSINESS'];2;BUSINESS:ASIA
44970;Cryptocurrency Regulation in Malta: Embracing The Crypto Revolution;POSITIVE;['REGULATION', 'EXCHANGE'];2;EXCHANGE:REGULATION
11449665;Ethereum Takes $1,900, Ratio Rises For Staking Unlock;POSITIVE;['ETH', 'SPONSORED'];2;ETH:SPONSORED
12065836;Kucoin Exchange Twitter Account Hacked, Pledges to Reimburse Affected Users – Here's the Latest;NEGATIVE;['EXCHANGE'];1;EXCHANGE
15060342;Ethereum ICO Participant Ends 8-year Slumber;POSITIVE;['ETH', 'ICO', 'EXCHANGE'];3;EXCHANGE:ICO:ETH
14757434;Multichain’s ‘mysterious withdrawals’ have whiffs of a ‘rug pull’ — Chainalysis;NEGATIVE;['MARKET'];1;MARKET
12982078;Can Solana overcome the FTX collapse? Avorak AI provides deep-learning insights;NEUTRAL;['SOL', 'BLOCKCHAIN', 'ETH', 'EXCHANGE', 'SPONSORED'];5;EXCHANGE:BLOCKCHAIN:ETH
10161362;NFT Factory Paris President: NFTs 'Will Be Active Whether We Are in a Bear or Bull Market';NEUTRAL;['REGULATION', 'TRADING', 'MARKET'];3;TRADING:MARKET:REGULATION
3957323;300,000 ETH and 20,000 Bitcoin Withdrawn From FTX, BIT and Sol Down, FTT -25%;NEUTRAL;['BTC', 'ETH', 'EXCHANGE', 'SOL', 'SPONSORED'];5;BTC:EXCHANGE:ETH
3786021;Ripple Vs SEC Lawsuit Gets The Final Ruling Date;NEUTRAL;['REGULATION', 'XRP'];2;REGULATION:XRP
3857809;Bitcoin is real money, a “safe haven” asset as per this big-name in finance;POSITIVE;['BTC', 'FIAT', 'COMMODITY', 'MARKET'];4;MARKET:BTC:FIAT
14684522;XRP Demonstrates Impressive Growth Milestones in Q2, Reveals Messari Report;POSITIVE;['XRP', 'MARKET', 'REGULATION'];3;MARKET:REGULATION:XRP
13361018;Binance NFT Marketplace adds support for Bitcoin NFT Collections;NEUTRAL;['EXCHANGE', 'BTC', 'REGULATION', 'BLOCKCHAIN', 'ICO'];5;BTC:EXCHANGE:BLOCKCHAIN
11462087;Is Texas Still 'Very Open for Business' for Bitcoin Mining?;NEUTRAL;['MINING', 'BTC', 'BUSINESS', 'REGULATION'];4;BTC:BUSINESS:REGULATION
12714972;Market Analysis Report (17 May 2023);NEUTRAL;['MARKET', 'BTC', 'ETH', 'ICO', 'REGULATION'];5;MARKET:BTC:REGULATION
49803;Coinbase-Backed Portal Announces Partnership With Mintlayer in a Major Push for Bitcoin-Based DeFi;POSITIVE;['BTC', 'BLOCKCHAIN', 'MARKET', 'SPONSORED'];4;MARKET:BTC:BLOCKCHAIN
13062318;Terra Classic Community Gets First Sneak Peek of Edward Kim’s AI Chain;POSITIVE;['LUNC', 'MARKET'];2;MARKET
12284531;Trader Who Called 2023 Crypto Turnaround Warns Bitcoin Giving Bears Maximum Opportunity – Here’s Why;NEGATIVE;['BTC', 'TRADING', 'MINING'];3;TRADING:BTC:MINING
24698;Harmony Protocol Attacker Starts Laundering Money Through Tornado Cash;NEGATIVE;['ALTCOIN', 'BLOCKCHAIN', 'ETH'];3;BLOCKCHAIN:ETH:ALTCOIN
5795617;Musk’s Bans Put Twitter on ‘Path to Authoritarianism’: ETH Founder;NEGATIVE;['ETH', 'MARKET'];2;MARKET:ETH
29575;Is Multibillion-Dollar Hedge Fund Three Arrows Next to Unravel? Here’s What’s Going On;NEGATIVE;['BUSINESS', 'ETH', 'MARKET'];3;MARKET:BUSINESS:ETH
2913418;Quebec’s Mohawk Council of Kahnawake explores Bitcoin mining via hydro-power;POSITIVE;['BTC', 'MINING', 'BLOCKCHAIN'];3;BTC:BLOCKCHAIN:MINING
13126304;Blockchain Association Files Another Amicus Brief Supporting Tornado Cash, Says Crypto Mixer Is ‘Simply a Tool’;NEUTRAL;['BLOCKCHAIN'];1;BLOCKCHAIN
6079311;Eight in 10 Russians Say Bitcoin Is World’s Most Reliable Digital Asset;POSITIVE;['BTC', 'EXCHANGE'];2;BTC:EXCHANGE
13988054;Ninja Warriors Meta launches second presale ahead of Full Gameplay Release in Q4 2023;POSITIVE;['BLOCKCHAIN', 'ICO', 'BUSINESS', 'USDT', 'MATIC'];5;BUSINESS:BLOCKCHAIN:ICO
786082;Vitalik Buterin Shares His Perspective on Corporate Development of the Metaverse;NEGATIVE;['ETH', 'BLOCKCHAIN', 'BUSINESS'];3;BUSINESS:BLOCKCHAIN:ETH
11859634;Tether market cap eyes record high after regaining 65% stablecoin dominance;POSITIVE;['USDT', 'MARKET', 'FIAT', 'REGULATION'];4;MARKET:REGULATION:FIAT
13102864;Koyo Burns 152 Million Shiba Inu in One Transaction;POSITIVE;['SHIB', 'ICO', 'MARKET'];3;MARKET:ICO:SHIB
10641445;Bitcoin futures premium falls to lowest level in a year, triggering traders' alerts;NEGATIVE;['BTC', 'MARKET', 'FIAT'];3;MARKET:BTC:FIAT
15738003;Unusually High SHIB Tokens Set Ablaze Despite Anemic Price Outlook;NEGATIVE;['SHIB', 'ICO', 'TRADING'];3;TRADING:ICO:SHIB
11781965;Withdrawals Post-Shapella Could Take Weeks On Binance;NEGATIVE;['EXCHANGE', 'ETH', 'TRADING'];3;TRADING:EXCHANGE:ETH
3851721;Terra Rebels Receive $19K Donation For LUNC Revival￼;POSITIVE;['LUNC'];1;
13972632;Poliant.com Releases Follow the Whale, the First AI Pool in the Crypto Market;POSITIVE;['MARKET', 'ICO', 'REGULATION', 'TECHNOLOGY', 'EXCHANGE'];5;MARKET:EXCHANGE:REGULATION
10675585;Here’s What Pushed Ethereum (ETH) Higher After Market Dip: Details;NEUTRAL;['ETH', 'MARKET'];2;MARKET:ETH
12154060;CFTC wins record $3.4B penalty payment in Bitcoin-related fraud case;POSITIVE;['BTC'];1;BTC
9010437;GRT plots rising graph as it surges 30% in 24 hours: More to come?;POSITIVE;['ALTCOIN', 'ICO', 'MARKET'];3;MARKET:ICO:ALTCOIN
14121571;SEC nixes $30M fine from BlockFi until bankrupt crypto lender repays investors;NEUTRAL;['REGULATION', 'BUSINESS', 'EXCHANGE', 'MARKET', 'MINING'];5;MARKET:BUSINESS:EXCHANGE
12101624;US Treasury Sanctions Individuals Connected to Lazarus Group;NEUTRAL;['REGULATION'];1;REGULATION
15518445;Flash Warning for Those Altcoins! All Could Be in Danger After Curve Finance (CRV)!;NEGATIVE;['CRV', 'ALTCOIN', 'BLOCKCHAIN', 'MARKET'];4;MARKET:BLOCKCHAIN:ALTCOIN
911686;Crypto firms failed to deliver 'promised benefits' from lawmaker-backed incentives, says nonprofit;NEGATIVE;['REGULATION', 'TECHNOLOGY'];2;REGULATION:TECHNOLOGY
12113902;Crypto Analyst Reveals BTC Miner Reserves Experienced a Drop;NEGATIVE;['BTC', 'MARKET', 'MINING'];3;MARKET:BTC:MINING
15945091;Bitcoin, BCH, and Litecoin Fall After LTC Halving, Traders Joining the Winning Side With QUBE;NEUTRAL;['LTC', 'BCH', 'BLOCKCHAIN', 'ICO', 'SPONSORED'];5;BLOCKCHAIN:ICO:SPONSORED
34372;What ‘Responsibility’ Do Token Airdrop Recipients Have?;NEGATIVE;['ICO', 'TRADING'];2;TRADING:ICO
14771129;Aave’s Bold Leap into the Stablecoin Arena!;POSITIVE;['AAVE', 'BLOCKCHAIN', 'ETH'];3;BLOCKCHAIN:ETH
42964;Dogecoin testing support at $0.08: What to expect?;NEGATIVE;['TRADING', 'DOGE', 'MARKET', 'BLOCKCHAIN', 'BUSINESS'];5;TRADING:MARKET:BUSINESS
6090398;Core Scientific to File for Chapter 11 Bankruptcy in Texas;NEGATIVE;['BLOCKCHAIN', 'BTC', 'BUSINESS', 'MINING'];4;BTC:BUSINESS:BLOCKCHAIN
15393286;"Kyrgyzstan To Build Crypto Mining Farms; President Approves!";POSITIVE;['MINING', 'REGULATION', 'BTC'];3;BTC:REGULATION:MINING
12844692;UK Will Need New Laws to Accommodate Future Digital Pound, Lawyers Say;NEUTRAL;['FIAT', 'REGULATION', 'MARKET'];3;MARKET:REGULATION:FIAT
3857029;Swiss data and analytics service Nuant prepares for the Q4 launch of the first unified platform for digital asset data, analytics & portfolio intelligence;POSITIVE;['BLOCKCHAIN', 'BTC', 'EXCHANGE', 'MARKET', 'SPONSORED'];5;MARKET:BTC:EXCHANGE
3852560;Top 5 Interoperability Tokens Below $200M Market Cap to Watch in October 2022;NEUTRAL;['ICO', 'MARKET', 'BLOCKCHAIN', 'SPONSORED', 'TRADING'];5;TRADING:MARKET:BLOCKCHAIN
31119;Stellar Lumen (XLM) Price Dives 20%, Could Revisit $0.10;NEGATIVE;['XLM', 'TRADING', 'BTC', 'FIAT'];4;TRADING:BTC:FIAT
12932759;Former Coinone’s Exec Admits the Bribery Charges in South Korea;NEGATIVE;['ASIA'];1;ASIA
6658719;Solana’s misery continues as development activity takes a back seat;NEGATIVE;['SOL', 'ALTCOIN', 'BUSINESS'];3;BUSINESS:ALTCOIN
3850216;Users Have Until December to Withdraw Assets From Crypto Bank Nuri;NEUTRAL;['FIAT', 'TRADING'];2;TRADING:FIAT
14532537;Pro-XRP Lawyer Deaton Slams SEC, Says Agency Has Lost Its Way;NEGATIVE;['REGULATION', 'EXCHANGE', 'MARKET', 'XRP'];4;MARKET:EXCHANGE:REGULATION
13588078;Canada’s accounting giant KPMG adds Bitcoin to its corporate treasury;POSITIVE;['BTC', 'ETH', 'REGULATION'];3;BTC:REGULATION:ETH
36625;Crypto exchange WhiteBit buys Ukraine’s Eurovision trophy in auction for armed forces;NEUTRAL;['EXCHANGE', 'ICO'];2;EXCHANGE:ICO
12687513;Hundreds of Millions of DOGE Dumped as Dogecoin Miners Cash Out;NEGATIVE;['DOGE'];1;DOGE
12368702;Sparklo (SPRK) Showcases Bullish Outlook while Aave (AAVE) and Theta Network (THETA) Have Worrying Performance;NEUTRAL;['AAVE', 'TRADING', 'BLOCKCHAIN', 'BUSINESS', 'TECHNOLOGY', 'SPONSORED'];6;TRADING:BUSINESS:BLOCKCHAIN
13174359;Elon Musk Accused Of Dogecoin Insider Trading, Tradecurve Offers a Trading Academy;NEUTRAL;['TRADING', 'DOGE', 'MARKET', 'SPONSORED'];4;TRADING:MARKET:SPONSORED
44697;Role of Plugin’s Blockchain Technology in Weather Forecast;POSITIVE;['BLOCKCHAIN', 'SPONSORED', 'TECHNOLOGY'];3;BLOCKCHAIN:SPONSORED:TECHNOLOGY
11113194;Canadian ‘crypto king’ allegedly kidnapped and tortured over multi-million dollar investment scam;NEGATIVE;['FIAT', 'BUSINESS'];2;BUSINESS:FIAT
14242635;FTX CEO Claims Extravagant Spending on Cartoon, Book, and ‘Pineapple House;NEGATIVE;['ETH', 'EXCHANGE'];2;EXCHANGE:ETH
9721004;TCNH, a Stablecoin Pegged to Offshore Chinese Yuan, listed on Huobi;NEUTRAL;['ASIA', 'SPONSORED'];2;SPONSORED:ASIA
14274001;"Expert Projects XRP Breakout from Multi-Year Ascending Triangle; Rally Incoming?";POSITIVE;['XRP', 'TRADING', 'MARKET'];3;TRADING:MARKET:XRP
13499552;The Much Anticipated Ethereum’s London Hard Fork is Live Now;POSITIVE;['ETH', 'EXCHANGE'];2;EXCHANGE:ETH
10979700;SEC Sues Tron’s Justin Sun, Lindsay Lohan, and More Celebs;NEGATIVE;['REGULATION', 'BLOCKCHAIN', 'ICO', 'TRX'];4;BLOCKCHAIN:REGULATION:ICO
1125353;Curve Finance Hacked With $573,000 Stolen So Far;NEGATIVE;['CRV', 'BLOCKCHAIN', 'EXCHANGE', 'ICO', 'SOL'];5;EXCHANGE:BLOCKCHAIN:ICO
7444396;Coinbase to Shutter Bulk of Operations in Japan;NEUTRAL;['ASIA', 'BUSINESS'];2;BUSINESS:ASIA
1917930;Monetary Authority of Singapore is planning on tougher crypto regulations;NEUTRAL;['ASIA', 'BUSINESS', 'BLOCKCHAIN', 'TRADING'];4;TRADING:BUSINESS:BLOCKCHAIN
13575496;DOGE Price Prediction: Dogecoin fails to attract the bulls even after a tweet from Elon Musk;NEGATIVE;['DOGE', 'TRADING'];2;TRADING:DOGE
10703200;USDC’s loss was CEXs’ gain? Well, the real story is…;NEUTRAL;['ALTCOIN', 'ICO', 'MARKET'];3;MARKET:ICO:ALTCOIN
12035486;Sparklo (SPRK) Presale Chosen Over Axie Infinity (AXS) and IOTA (MIOTA) By Investors;POSITIVE;['AXS', 'BUSINESS', 'SPONSORED', 'TRADING'];4;TRADING:BUSINESS:SPONSORED
14328446;Trump NFTs Are Back—This Time, It's $50 Melania July 4 Collectibles;POSITIVE;['SOL', 'REGULATION', 'TRADING'];3;TRADING:REGULATION
48555;Colizeum Solves Mobile Game Monetization Issues Through Blockchain Technology, $ZEUM TGE On May 4th;POSITIVE;['BLOCKCHAIN', 'TECHNOLOGY', 'BUSINESS'];3;BUSINESS:BLOCKCHAIN:TECHNOLOGY
250720;Investment Firm BlackRock Loses $1.7 Trillion Over Last 6 Months;NEGATIVE;['BTC'];1;BTC
13493563;"Wormhole DeFi protocol hacked for $320M; Solana tokens dip below $100";NEGATIVE;['ICO', 'SOL', 'BLOCKCHAIN', 'BTC', 'ETH'];5;BTC:BLOCKCHAIN:ICO
12753990;Litecoin Activity Hits All-Time High Thanks to Ordinals Mania;NEUTRAL;['BLOCKCHAIN', 'LTC', 'BTC', 'BUSINESS'];4;BTC:BUSINESS:BLOCKCHAIN
2589;Here’s the true worth of AXS holders despite alt’s 91% slump;NEUTRAL;['AXS', 'ALTCOIN', 'MARKET', 'ICO'];4;MARKET:ICO:ALTCOIN
5575890;Binance Founder ‘CZ’ Insists We Can Trust His Crypto Exchange – but Can We?;NEUTRAL;['EXCHANGE', 'TECHNOLOGY'];2;EXCHANGE:TECHNOLOGY
15214061;I asked ChatGPT about BNB’s performance – the AI showed optimism;NEUTRAL;['ALTCOIN', 'EXCHANGE'];2;EXCHANGE:ALTCOIN
34450;Profit Opportunities During a Crypto Winter;NEGATIVE;['BUSINESS', 'LUNA', 'MARKET', 'SPONSORED'];4;MARKET:BUSINESS:SPONSORED
10540625;Monero scores high on social ranking, but is it enough to rejuvenate bulls;NEUTRAL;['XMR', 'ALTCOIN', 'BUSINESS', 'MARKET'];4;MARKET:BUSINESS:ALTCOIN
12893694;Multichain Token Crashes Over 20% Amid Reports of Users’ Funds Being Stuck;NEGATIVE;['BLOCKCHAIN', 'ICO'];2;BLOCKCHAIN:ICO
104092;FBI Warns The Public About Fake Cryptocurrency Apps;NEGATIVE;['BUSINESS', 'BTC', 'REGULATION', 'WALLET'];4;BTC:BUSINESS:REGULATION
11726931;Stabolut Launches New Bitcoin-backed, Decentralized Stablecoin, USB;POSITIVE;['ASIA'];1;ASIA
11950306;Double the deposit amount with Cerus Markets’ Trading Platform!;POSITIVE;['SPONSORED', 'MARKET', 'TRADING'];3;TRADING:MARKET:SPONSORED
6509695;Argo Blockchain Suspends Trading in the US Shares for 24 Hours;NEUTRAL;['BLOCKCHAIN', 'TRADING', 'BUSINESS', 'EXCHANGE'];4;TRADING:BUSINESS:EXCHANGE
932864;Justin Sun, Poloniex Back Plan to Create a PoW Ethereum Hard Fork;POSITIVE;['ETH', 'EXCHANGE', 'MINING', 'TRADING'];4;TRADING:EXCHANGE:ETH
12453705;Shiba Inu (SHIB) Is In Critical State: What's Happening?;NEGATIVE;['SHIB', 'MARKET'];2;MARKET:SHIB
14785348;Crypto Investment Products See Massive Institutional Inflows as $BTC, $ETH, and $XRP Products Lead;POSITIVE;['BTC', 'ETH', 'XRP', 'ALTCOIN', 'BUSINESS'];5;BTC:BUSINESS:ETH
13558433;New to Crypto? Here’s How You Get Started;POSITIVE;['ALTCOIN', 'BTC', 'DOGE', 'ICO', 'TRADING'];5;TRADING:BTC:ICO
4348903;Singaporean Investment Firm Temasek Writes Off $275 Million Investment in Bankrupt FTX;NEGATIVE;['ASIA', 'EXCHANGE'];2;EXCHANGE:ASIA
15668141;US Court Dismisses Tether & Bitfinex Suit 🚫;NEUTRAL;['USDT', 'EXCHANGE', 'FIAT', 'REGULATION'];4;EXCHANGE:REGULATION:FIAT
16004210;What a major approval means for Tron, TRX investors;POSITIVE;['TRX', 'ALTCOIN', 'BUSINESS'];3;BUSINESS:ALTCOIN
41418;On the Tech Powering Decentralized Storage;POSITIVE;['TECHNOLOGY', 'FIL'];2;TECHNOLOGY
45498;Top 3 Projects by Social Activity as per CryptoDep;NEUTRAL;['ALTCOIN', 'BLOCKCHAIN', 'XTZ'];3;BLOCKCHAIN:ALTCOIN
11299524;Bittrex Announces Closure of Operations in the US;NEGATIVE;['BLOCKCHAIN'];1;BLOCKCHAIN
452768;Optimism might see OP go high after these developments;POSITIVE;['CRV', 'ALTCOIN', 'BLOCKCHAIN', 'TRADING'];4;TRADING:BLOCKCHAIN:ALTCOIN
9075808;Crypto Pundit Labels Shiba Inu, DOGE as ‘Garbage’ — Can Shibarium Prove to be Game Changer for SHIB?;NEGATIVE;['DOGE', 'SHIB'];2;SHIB:DOGE
34673;New Crypto Lawsuits, Pan-Asian Crypto Regulations, Hiring Pause + More News;NEUTRAL;['REGULATION', 'BTC', 'EXCHANGE', 'MINING'];4;BTC:EXCHANGE:REGULATION
11645848;Well-Known Crypto Trader Sends Warning Over Bullish Alt Charts;NEUTRAL;['TRADING', 'ALTCOIN', 'BTC'];3;TRADING:BTC:ALTCOIN
14260208;Azuki Elementals sold out in the first 15 minutes;POSITIVE;['BLOCKCHAIN', 'MARKET'];2;MARKET:BLOCKCHAIN
2450415;"Cosmos Turns Bullish; ATOM May Deliver Huge Profits Soon!";POSITIVE;['ATOM', 'BLOCKCHAIN', 'EXCHANGE', 'TECHNOLOGY', 'TRADING'];5;TRADING:EXCHANGE:BLOCKCHAIN
10141229;Fidelity Set to Launch Dedicated Bitcoin and Crypto Platform;POSITIVE;['BTC', 'ICO', 'MARKET'];3;MARKET:BTC:ICO
5999202;Snowfall Protocol Is The New Favourite Among Investors While Trust Wallet Token And Neo Are Losing Base;NEUTRAL;['BLOCKCHAIN', 'ICO', 'BUSINESS', 'MARKET', 'SPONSORED'];5;MARKET:BUSINESS:BLOCKCHAIN
54701;Meta Plans To Take Nearly 50% Cut of Every NFT Transaction in Horizon Worlds’ Metaverse: Report;NEGATIVE;['ICO', 'TECHNOLOGY'];2;ICO:TECHNOLOGY
3384318;Brad Garlinghouse Explains Why He Thinks XRP Lawsuit Will End in Favor of Ripple;POSITIVE;['XRP', 'REGULATION', 'BLOCKCHAIN', 'EXCHANGE', 'ICO'];5;EXCHANGE:BLOCKCHAIN:REGULATION
14543279;Value Locked in Solana's Liquid Staking Protocols Surged by 91% in the First Half of the Year;POSITIVE;['SOL', 'MARKET'];2;MARKET
13587950;Japanese authorities to address potential crypto gaps in Russian sanctions;NEUTRAL;['ASIA', 'REGULATION'];2;REGULATION:ASIA
2991865;126 Million Shiba Inu Burnt in One Transaction, 132M in 24 Hours As Burn Rate Soars 1502%;NEUTRAL;['SHIB', 'ALTCOIN', 'MARKET'];3;MARKET:ALTCOIN:SHIB
12733008;Unveiling the Mystery: Trillions of SHIB Flow Into Accounts of Large Shiba Inu Holders;NEUTRAL;['SHIB', 'ICO', 'MARKET', 'EXCHANGE', 'ALTCOIN'];5;MARKET:EXCHANGE:ICO
7595294;Binance CEO Makes Jest of Jim Cramer’s BTC Prediction;NEUTRAL;['BTC', 'EXCHANGE', 'BLOCKCHAIN', 'BUSINESS'];4;BTC:BUSINESS:EXCHANGE
12841050;Sparklo (SPRK) Dominates With Presale while Uniswap (UNI) Stellar (XLM) Experience a Decline in Value;NEUTRAL;['UNI', 'XLM', 'BLOCKCHAIN', 'MARKET', 'SPONSORED'];5;MARKET:BLOCKCHAIN:SPONSORED
11717784;Warren Buffet says Bitcoin is a gambling token with no intrinsic value;NEGATIVE;['BTC', 'BUSINESS', 'ICO'];3;BTC:BUSINESS:ICO
13495025;Bitcoin rises nears $35K level in days following Musk, Wood, Dorsey comments;POSITIVE;['BTC', 'DOGE', 'ETH', 'EXCHANGE', 'LTC'];5;BTC:EXCHANGE:ETH
15837725;EOS Network Foundation urges community to reject $22 million settlement offer;NEGATIVE;['ETH', 'REGULATION'];2;REGULATION:ETH
5220054;Amazon Sabotaged to Not Accept Bitcoin;NEGATIVE;['BTC', 'SPONSORED'];2;BTC:SPONSORED
2201226;Fidelity Is Still Taking Flak for Its Crypto Offerings;NEGATIVE;['BTC', 'BUSINESS', 'ETH'];3;BTC:BUSINESS:ETH
13029480;Bitcoin Ordinals reaches milestone with BRC-20, but…;NEUTRAL;['BTC', 'ICO', 'TRADING'];3;TRADING:BTC:ICO
2051060;El Salvador Bitcoin bond delayed due to security concerns: Tether CTO;NEUTRAL;['BTC', 'USDT', 'EXCHANGE'];3;BTC:EXCHANGE
13495075;Bank of America gives some clients green light on trading bitcoin futures - Coindesk;POSITIVE;['FIAT', 'TRADING', 'BTC'];3;TRADING:BTC:FIAT
56806;Terra’s Luna Foundation Scoops up 4,130 Bitcoin Worth $176 Million;POSITIVE;['LUNA', 'BTC', 'ETH', 'AVAX', 'EXCHANGE'];5;BTC:EXCHANGE:ETH
45232;Binance Halts LUNA Withdrawals as Terra Token Plummets 50%;NEGATIVE;['LUNA', 'ICO', 'EXCHANGE', 'MARKET'];4;MARKET:EXCHANGE:ICO
15507758;LeetSwap, Base’s leading DEX, halts trading amid reports of an exploit;NEGATIVE;['TRADING', 'BLOCKCHAIN', 'EXCHANGE'];3;TRADING:EXCHANGE:BLOCKCHAIN
10825839;Dogecoin Price Up 6% As Elon Musk and DOGE Founder Take Jab at Jim Cramer;POSITIVE;['DOGE', 'TRADING'];2;TRADING:DOGE
14084458;Limited generative AI usage to be allowed in Japanese schools;NEUTRAL;['ASIA'];1;ASIA
13916311;Should Ethereum traders be cautious after the bounce above $1700;NEUTRAL;['ETH', 'ALTCOIN', 'MARKET'];3;MARKET:ETH:ALTCOIN
7893541;US Government Seizes Nearly $700,000,000 Worth of Sam Bankman-Fried’s Assets As Fraud Investigation Intensifies;NEGATIVE;['OTHER'];1;OTHER
15415301;Warren’s digital asset AML act gains momentum with BPI’s backing and bipartisan alliance;POSITIVE;['REGULATION', 'FIAT', 'MARKET'];3;MARKET:REGULATION:FIAT
12544440;Bitcoin Miner Marathon Receives Second SEC Subpoena in Connection to Montana Mining Facility Investigation;NEGATIVE;['REGULATION', 'MINING', 'BTC', 'EXCHANGE'];4;BTC:EXCHANGE:REGULATION
11339021;Crypto Whales Accumulating Ethereum Scaling Altcoin by the Millions, According to On-Chain Data;POSITIVE;['ETH', 'ALTCOIN', 'BLOCKCHAIN', 'EXCHANGE', 'ICO'];5;EXCHANGE:BLOCKCHAIN:ICO
15525121;Top Crypto Wallet Provider Ledger Issues New Alert to XRP Holders;NEGATIVE;['WALLET', 'XRP', 'MARKET'];3;MARKET:XRP
12683537;MiCA regulation unanimously approved by EU Council, here’s what it entails;POSITIVE;['REGULATION'];1;REGULATION
26569;An NFT Against All Odds: Secret Island Club Is Your Safest Investment Yet. Find out why;NEUTRAL;['MARKET', 'SPONSORED'];2;MARKET:SPONSORED
11195689;Coinbase said to be in talks with regulators to stay in Canada;NEUTRAL;['EXCHANGE', 'MARKET'];2;MARKET:EXCHANGE
14023599;Bitcoin Miner Iris Energy Shares Pop 21% After Major Hash Rate Expansion Plans;POSITIVE;['BUSINESS', 'MINING', 'BTC'];3;BTC:BUSINESS:MINING
11229345;Solana (SOL) Price Analysis for March 30;NEUTRAL;['SOL', 'MARKET', 'TRADING'];3;TRADING:MARKET
14083386;World Mobile Launches Token Buyback Program to Boost Sharing Economy Expansion;POSITIVE;['ICO', 'BLOCKCHAIN'];2;BLOCKCHAIN:ICO
14277818;While PEPE and FLOKI hype settles, more investors are joining DigiToads;NEUTRAL;['SPONSORED', 'BUSINESS', 'ICO'];3;BUSINESS:ICO:SPONSORED
35706;Whales Accumulate Huge Apecoin ($APE) Tokens With APE Fest On 20th June;POSITIVE;['ICO', 'ALTCOIN'];2;ICO:ALTCOIN
6628110;SNX finds favor with ETH whales but is it enough to turn things around?;NEUTRAL;['SNX', 'ETH', 'ALTCOIN', 'ICO', 'TRADING'];5;TRADING:ICO:ETH
10724434;Credit Suisse shares plummet as Saudi National Bank withholds support;NEGATIVE;['FIAT', 'MARKET'];2;MARKET:FIAT
3856980;$5 Million Ethereum Index Fund Debuted By Fidelity;POSITIVE;['ETH', 'MARKET', 'EXCHANGE', 'BTC', 'ICO'];5;MARKET:BTC:EXCHANGE
2646123;With Inflation at 8.3%, Ethereum Risks “Sell the News” Merge;NEGATIVE;['ETH', 'MARKET', 'TRADING'];3;TRADING:MARKET:ETH
13765280;SHIB loses nearly 40,000 holders in less than a week;NEGATIVE;['SHIB', 'ICO', 'MARKET'];3;MARKET:ICO:SHIB
12659499;Ethereum [ETH] in the spotlight: From Finality halt to recovery attempt, and more;NEUTRAL;['ETH', 'ALTCOIN', 'BLOCKCHAIN', 'TRADING'];4;TRADING:BLOCKCHAIN:ETH
34570;Terra LUNA 2.0: How many coins are there? How to buy it in the USA;NEUTRAL;['LUNA', 'TRADING', 'XRP'];3;TRADING:XRP
3599771;Blockchain and Non-Fungible Tokens Masterclass: Understanding New Technologies and the Relevant Law Training Course – March 2, 2023 – ResearchAndMarkets.com;NEUTRAL;['ICO', 'REGULATION', 'BLOCKCHAIN'];3;BLOCKCHAIN:REGULATION:ICO
15338683;"Fed Raises Rates by 25 bps; Hints at Further Increase in September";NEUTRAL;['BTC', 'FIAT', 'MARKET'];3;MARKET:BTC:FIAT
5936884;Grayscale Will Explore Returning Portion of Investor Capital if SEC Refuses Spot Bitcoin ETF;NEUTRAL;['BTC', 'BUSINESS', 'REGULATION'];3;BTC:BUSINESS:REGULATION
10623811;602M Shiba Inu Burned in a Day As Newly Launched Token Burns 592M SHIB;NEUTRAL;['SHIB', 'ICO', 'MARKET'];3;MARKET:ICO:SHIB
11987960;Solana launches emissions dashboard to spur blockchain carbon footprint transparency;NEUTRAL;['SOL', 'BLOCKCHAIN', 'ETH', 'MINING', 'TECHNOLOGY'];5;BLOCKCHAIN:ETH:TECHNOLOGY
14503494;Hong Kong urged to issue stablecoin to compete with Tether and USDC;POSITIVE;['ASIA', 'USDT', 'FIAT'];3;FIAT:ASIA
13717558;Binance Faces Regulatory Hurdle in Nigeria: Ordered to Cease Operations;NEGATIVE;['EXCHANGE', 'REGULATION', 'TRADING'];3;TRADING:EXCHANGE:REGULATION
10978087;Recent Whale Transactions Foreshadow a Potential SUSHI Sell-off;NEGATIVE;['SUSHI', 'ALTCOIN', 'EXCHANGE', 'ICO', 'TRADING'];5;TRADING:EXCHANGE:ICO
6556634;Mango Markets Scam: Alleged Crypto Trader Arrested in Puerto Rico;NEGATIVE;['MARKET', 'EXCHANGE'];2;MARKET:EXCHANGE
15360474;Elon Musk’s Potential Stablecoin Sparks Bipartisan Concern;NEGATIVE;['MARKET', 'TECHNOLOGY'];2;MARKET:TECHNOLOGY
13557611;$SHIB Investors Are Looking to Adopt Actual Shiba Inu Puppies;POSITIVE;['SHIB', 'BUSINESS', 'ALTCOIN', 'TRADING'];4;TRADING:BUSINESS:ALTCOIN
3851067;EU Takes Aim At Bitcoin Mining Industry With Upcoming Draft Law: Report;NEGATIVE;['REGULATION', 'BTC', 'MINING'];3;BTC:REGULATION:MINING
5981326;$1.7M in Bitcoin tied to QuadrigaCX reawakens after years of dormancy;NEUTRAL;['BTC', 'BLOCKCHAIN', 'EXCHANGE'];3;BTC:EXCHANGE:BLOCKCHAIN
11953450;Bitcoin ignores US jobs data as BTC price dip puts $28K support at risk;NEGATIVE;['BTC', 'EXCHANGE', 'FIAT', 'TRADING'];4;TRADING:BTC:EXCHANGE
52743;Binance Restricts Services In Russia Citing EU’s Fifth Package Of Sanctions;NEGATIVE;['EXCHANGE'];1;EXCHANGE
12849171;Apple and Google can undermine decentralization, Coinbase ex-CTO says;NEGATIVE;['TECHNOLOGY', 'BTC'];2;BTC:TECHNOLOGY
36605;Ethereum transactions drop to 18-month low as market attempts to recuperate;NEGATIVE;['ETH', 'MARKET'];2;MARKET:ETH
12781023;Hong Kong enlists HSBC, Visa, and more to test digital currency;POSITIVE;['ASIA', 'FIAT'];2;FIAT:ASIA
14255570;Stealthy Crypto Malware Found in Popular Super Mario Game – Here's the Latest;NEGATIVE;['MINING', 'XMR', 'RESEARCH'];3;MINING
12059218;Bitcoin Posts Biggest Weekly Loss in 5 Months as Dollar Liquidity Declines, Debt Ceiling Fears Return;NEGATIVE;['BTC', 'FIAT', 'MARKET'];3;MARKET:BTC:FIAT
10427014;Arbitrum Airdrop: Traders Bet Ethereum Layer-2 Will Airdrop Its Token by March 31;NEUTRAL;['ETH', 'ICO', 'MARKET'];3;MARKET:ICO:ETH
